{
  "schema_version": "sensei.dashboard.provider-capabilities.v1",
  "provider_id": "claude-code",
  "runtime": "claude-code",
  "capabilities": {
    "interactive_auth": "supported",
    "browser_auth": "supported",
    "headless_execution": "conditional",
    "streaming_output": "supported",
    "session_resume": "supported",
    "mcp": "supported",
    "skills": "supported",
    "sandboxing": "conditional",
    "command_approvals": "supported",
    "file_approvals": "supported",
    "structured_output": "supported"
  },
  "recorded_at": "2026-07-25T09:00:00Z"
}
